context,question,answer
"Điều 65 Luật Giao thông đường bộ 2008 quy định: Cảnh sát giao thông có quyền xử phạt vi phạm hành chính về giao thông đường bộ theo quy định.","Ai có quyền xử phạt vi phạm hành chính về giao thông đường bộ?","Cảnh sát giao thông có quyền xử phạt vi phạm hành chính về giao thông đường bộ."
"Điều 66 Luật Giao thông đường bộ 2008 quy định: Cảnh sát giao thông có quyền dừng phương tiện để kiểm tra giấy tờ và xử lý vi phạm.","Cảnh sát giao thông có quyền gì khi kiểm tra phương tiện?","Cảnh sát giao thông có quyền dừng phương tiện để kiểm tra giấy tờ và xử lý vi phạm."
"Điều 67 Luật Giao thông đường bộ 2008 quy định: Người vi phạm giao thông phải chấp hành lệnh kiểm tra, kiểm soát của cảnh sát giao thông.","Người vi phạm giao thông phải làm gì khi bị kiểm tra?","Người vi phạm phải chấp hành lệnh kiểm tra, kiểm soát của cảnh sát giao thông."
"Điều 68 Luật Giao thông đường bộ 2008 quy định: Cơ quan quản lý đường bộ có trách nhiệm tổ chức, quản lý và bảo trì đường bộ.","Ai có trách nhiệm quản lý và bảo trì đường bộ?","Cơ quan quản lý đường bộ có trách nhiệm tổ chức, quản lý và bảo trì đường bộ."
"Điều 69 Luật Giao thông đường bộ 2008 quy định: Bộ Giao thông vận tải chịu trách nhiệm quản lý nhà nước về giao thông đường bộ trên phạm vi cả nước.","Ai chịu trách nhiệm quản lý nhà nước về giao thông đường bộ?","Bộ Giao thông vận tải chịu trách nhiệm quản lý nhà nước về giao thông đường bộ."
"Điều 70 Luật Giao thông đường bộ 2008 quy định: Ủy ban nhân dân các cấp có trách nhiệm quản lý giao thông đường bộ trong phạm vi địa phương.","Ủy ban nhân dân các cấp có trách nhiệm gì về giao thông đường bộ?","Ủy ban nhân dân các cấp có trách nhiệm quản lý giao thông đường bộ trong phạm vi địa phương."
"Điều 71 Luật Giao thông đường bộ 2008 quy định: Bộ Công an chịu trách nhiệm phối hợp với Bộ Giao thông vận tải trong quản lý an toàn giao thông đường bộ.","Bộ Công an có trách nhiệm gì trong quản lý giao thông đường bộ?","Bộ Công an phối hợp với Bộ Giao thông vận tải trong quản lý an toàn giao thông đường bộ."
"Điều 72 Luật Giao thông đường bộ 2008 quy định: Bộ Quốc phòng chịu trách nhiệm quản lý phương tiện quân sự tham gia giao thông đường bộ.","Ai quản lý phương tiện quân sự tham gia giao thông đường bộ?","Bộ Quốc phòng quản lý phương tiện quân sự tham gia giao thông đường bộ."
"Điều 73 Luật Giao thông đường bộ 2008 quy định: Cơ quan, tổ chức, cá nhân có trách nhiệm phối hợp với cơ quan quản lý giao thông trong đảm bảo an toàn giao thông.","Ai có trách nhiệm phối hợp đảm bảo an toàn giao thông?","Cơ quan, tổ chức, cá nhân có trách nhiệm phối hợp với cơ quan quản lý giao thông."
"Điều 74 Luật Giao thông đường bộ 2008 quy định: Chính phủ ban hành quy định chi tiết về quản lý, sử dụng và bảo trì đường bộ.","Ai ban hành quy định chi tiết về quản lý đường bộ?","Chính phủ ban hành quy định chi tiết về quản lý, sử dụng và bảo trì đường bộ."
"Điều 75 Luật Giao thông đường bộ 2008 quy định: Bộ trưởng Bộ Giao thông vận tải quy định về tốc độ xe và đặt biển báo tốc độ trên các tuyến quốc lộ.","Ai quy định về tốc độ xe trên quốc lộ?","Bộ trưởng Bộ Giao thông vận tải quy định về tốc độ xe và đặt biển báo tốc độ trên quốc lộ."
"Điều 76 Luật Giao thông đường bộ 2008 quy định: Chủ tịch Ủy ban nhân dân cấp tỉnh tổ chức đặt biển báo tốc độ trên các tuyến đường do địa phương quản lý.","Ai tổ chức đặt biển báo tốc độ trên đường địa phương?","Chủ tịch Ủy ban nhân dân cấp tỉnh tổ chức đặt biển báo tốc độ trên đường địa phương."
"Điều 77 Luật Giao thông đường bộ 2008 quy định: Bộ Giao thông vận tải quy định về đào tạo, sát hạch và cấp giấy phép lái xe.","Ai quy định về đào tạo và cấp giấy phép lái xe?","Bộ Giao thông vận tải quy định về đào tạo, sát hạch và cấp giấy phép lái xe."
"Điều 78 Luật Giao thông đường bộ 2008 quy định: Bộ Giao thông vận tải quy định về kiểm định an toàn kỹ thuật và bảo vệ môi trường của phương tiện.","Ai quy định về kiểm định an toàn kỹ thuật của phương tiện?","Bộ Giao thông vận tải quy định về kiểm định an toàn kỹ thuật và bảo vệ môi trường."
"Điều 79 Luật Giao thông đường bộ 2008 quy định: Bộ Công an quy định về đăng ký, cấp biển số phương tiện giao thông đường bộ.","Ai quy định về đăng ký và cấp biển số phương tiện?","Bộ Công an quy định về đăng ký và cấp biển số phương tiện giao thông."
"Điều 80 Luật Giao thông đường bộ 2008 quy định: Bộ Tài chính quy định về phí sử dụng đường bộ và các loại phí liên quan đến giao thông đường bộ.","Ai quy định về phí sử dụng đường bộ?","Bộ Tài chính quy định về phí sử dụng đường bộ và các loại phí liên quan."
"Điều 81 Luật Giao thông đường bộ 2008 quy định: Bộ Giao thông vận tải phối hợp với các bộ, ngành liên quan xây dựng quy hoạch giao thông đường bộ.","Ai chịu trách nhiệm xây dựng quy hoạch giao thông đường bộ?","Bộ Giao thông vận tải phối hợp với các bộ, ngành xây dựng quy hoạch giao thông đường bộ."
"Điều 82 Luật Giao thông đường bộ 2008 quy định: Chính phủ tổ chức thực hiện chính sách ưu tiên phát triển vận tải hành khách công cộng.","Ai tổ chức thực hiện chính sách phát triển vận tải hành khách công cộng?","Chính phủ tổ chức thực hiện chính sách ưu tiên phát triển vận tải hành khách công cộng."
"Điều 83 Luật Giao thông đường bộ 2008 quy định: Các cơ quan, tổ chức, cá nhân có trách nhiệm tuyên truyền, phổ biến pháp luật về giao thông đường bộ.","Ai có trách nhiệm tuyên truyền pháp luật về giao thông đường bộ?","Các cơ quan, tổ chức, cá nhân có trách nhiệm tuyên truyền pháp luật về giao thông đường bộ."
"Điều 84 Luật Giao thông đường bộ 2008 quy định: Người nước ngoài điều khiển phương tiện tại Việt Nam phải có giấy phép lái xe quốc tế hoặc quốc gia được Việt Nam công nhận.","Người nước ngoài điều khiển phương tiện tại Việt Nam cần giấy phép gì?","Người nước ngoài cần giấy phép lái xe quốc tế hoặc quốc gia được Việt Nam công nhận."
"Điều 85 Luật Giao thông đường bộ 2008 quy định: Phương tiện giao thông đường bộ của người nước ngoài phải được đăng ký tạm thời theo quy định.","Phương tiện của người nước ngoài tham gia giao thông cần gì?","Phương tiện của người nước ngoài phải được đăng ký tạm thời theo quy định."
"Điều 86 Luật Giao thông đường bộ 2008 quy định: Các hiệp định, thỏa thuận quốc tế về giao thông đường bộ mà Việt Nam tham gia được áp dụng nếu không trái với luật Việt Nam.","Hiệp định quốc tế về giao thông đường bộ được áp dụng khi nào?","Hiệp định quốc tế được áp dụng nếu không trái với luật Việt Nam."
"Điều 87 Luật Giao thông đường bộ 2008 quy định: Luật này có hiệu lực từ ngày 1/7/2009, thay thế Luật Giao thông đường bộ 2001.","Luật Giao thông đường bộ 2008 có hiệu lực từ khi nào?","Luật Giao thông đường bộ 2008 có hiệu lực từ ngày 1/7/2009."
"Điều 88 Luật Giao thông đường bộ 2008 quy định: Các văn bản quy phạm pháp luật liên quan đến giao thông đường bộ trước đó hết hiệu lực khi Luật này có hiệu lực.","Điều gì xảy ra với các văn bản pháp luật trước khi Luật Giao thông đường bộ 2008 có hiệu lực?","Các văn bản pháp luật trước đó hết hiệu lực khi Luật Giao thông đường bộ 2008 có hiệu lực."
"Điều 89 Luật Giao thông đường bộ 2008 quy định: Chính phủ ban hành quy định chi tiết thi hành Luật Giao thông đường bộ 2008.","Ai ban hành quy định chi tiết thi hành Luật Giao thông đường bộ 2008?","Chính phủ ban hành quy định chi tiết thi hành Luật Giao thông đường bộ 2008."