context,question,answer
"Điều 1 Luật Giao thông đường bộ 2008 quy định: Luật này điều chỉnh các quy tắc giao thông đường bộ, kết cấu hạ tầng giao thông đường bộ, phương tiện và người tham gia giao thông đường bộ, vận tải đường bộ và quản lý nhà nước về giao thông đường bộ.","Phạm vi điều chỉnh của Luật Giao thông đường bộ 2008 là gì?","Luật Giao thông đường bộ 2008 điều chỉnh quy tắc, hạ tầng, phương tiện, người tham gia giao thông, vận tải và quản lý nhà nước về giao thông đường bộ."
"Điều 2 Luật Giao thông đường bộ 2008 quy định: Luật này áp dụng đối với tổ chức, cá nhân liên quan đến giao thông đường bộ trên lãnh thổ Việt Nam.","Luật Giao thông đường bộ 2008 áp dụng cho đối tượng nào?","Luật áp dụng cho tổ chức, cá nhân liên quan đến giao thông đường bộ trên lãnh thổ Việt Nam."
"Điều 3 Luật Giao thông đường bộ 2008 giải thích: Người tham gia giao thông là người điều khiển, sử dụng phương tiện, dẫn dắt súc vật hoặc đi bộ trên đường bộ; người lái xe là người điều khiển xe cơ giới.","Theo Luật Giao thông đường bộ 2008, người tham gia giao thông bao gồm những ai?","Người tham gia giao thông gồm người điều khiển, sử dụng phương tiện, dẫn dắt súc vật hoặc đi bộ trên đường bộ."
"Điều 4 Luật Giao thông đường bộ 2008 quy định: Người tham gia giao thông phải tuân thủ quy tắc giao thông, đảm bảo an toàn cho mình và người khác; mọi vi phạm phải được phát hiện, xử lý nghiêm minh.","Nguyên tắc cơ bản của hoạt động giao thông đường bộ là gì?","Người tham gia giao thông phải tuân thủ quy tắc, đảm bảo an toàn, và vi phạm phải được xử lý nghiêm minh."
"Điều 5 Luật Giao thông đường bộ 2008 quy định: Nhà nước ưu tiên phát triển giao thông đường bộ, đặc biệt ở vùng kinh tế trọng điểm, miền núi, vùng sâu, vùng xa, biên giới, hải đảo và dân tộc thiểu số.","Chính sách phát triển giao thông đường bộ của Nhà nước là gì?","Nhà nước ưu tiên phát triển giao thông đường bộ ở vùng kinh tế trọng điểm, miền núi, vùng sâu, vùng xa, biên giới, hải đảo và dân tộc thiểu số."
"Điều 6 Luật Giao thông đường bộ 2008 quy định: Quy hoạch giao thông đường bộ phải xác định mục tiêu, quy mô, nhu cầu sử dụng đất, vốn, nhân lực và giải pháp thực hiện.","Yêu cầu của quy hoạch giao thông đường bộ là gì?","Quy hoạch phải xác định mục tiêu, quy mô, nhu cầu đất, vốn, nhân lực và giải pháp thực hiện."
"Điều 7 Luật Giao thông đường bộ 2008 quy định: Hoạt động giao thông đường bộ phải bảo đảm trật tự, an toàn, thông suốt và hiệu quả, không gây ô nhiễm môi trường.","Mục tiêu của hoạt động giao thông đường bộ là gì?","Hoạt động giao thông đường bộ phải bảo đảm trật tự, an toàn, thông suốt, hiệu quả và không gây ô nhiễm môi trường."
"Điều 8 Luật Giao thông đường bộ 2008 quy định các hành vi bị cấm, như điều khiển phương tiện có nồng độ cồn vượt quá mức cho phép, đua xe trái phép, hoặc gây cản trở giao thông.","Hành vi nào bị cấm theo Điều 8 Luật Giao thông đường bộ 2008?","Điều khiển phương tiện có nồng độ cồn vượt mức cho phép, đua xe trái phép, hoặc gây cản trở giao thông là các hành vi bị cấm."
"Điều 9 Luật Giao thông đường bộ 2008 quy định: Người tham gia giao thông phải đi bên phải, đúng làn đường, phần đường quy định và chấp hành hệ thống báo hiệu đường bộ.","Quy tắc chung khi tham gia giao thông đường bộ là gì?","Người tham gia giao thông phải đi bên phải, đúng làn đường, phần đường và chấp hành báo hiệu đường bộ."
"Điều 10 Luật Giao thông đường bộ 2008 quy định: Người điều khiển phương tiện phải có giấy phép lái xe, giấy đăng ký xe và giấy chứng nhận bảo hiểm trách nhiệm dân sự.","Người điều khiển phương tiện phải mang theo giấy tờ gì khi tham gia giao thông?","Người điều khiển phương tiện phải mang giấy phép lái xe, giấy đăng ký xe và giấy chứng nhận bảo hiểm trách nhiệm dân sự."
"Điều 11 Luật Giao thông đường bộ 2008 quy định: Người đi bộ phải đi trên vỉa hè, nếu không có vỉa hè thì đi sát lề đường bên phải theo chiều đi.","Người đi bộ phải đi ở đâu theo quy định?","Người đi bộ phải đi trên vỉa hè hoặc sát lề đường bên phải nếu không có vỉa hè."
"Điều 12 Luật Giao thông đường bộ 2008 quy định: Người điều khiển xe cơ giới phải tuân thủ tốc độ, giữ khoảng cách an toàn với xe phía trước và chấp hành biển báo cự ly.","Quy định về tốc độ và khoảng cách khi điều khiển xe cơ giới là gì?","Người điều khiển xe cơ giới phải tuân thủ tốc độ, giữ khoảng cách an toàn và chấp hành biển báo cự ly."
"Điều 13 Luật Giao thông đường bộ 2008 quy định: Xe cơ giới, xe máy chuyên dùng phải nhường đường cho xe ưu tiên khi có tín hiệu ưu tiên.","Xe cơ giới phải nhường đường cho xe nào?","Xe cơ giới phải nhường đường cho xe ưu tiên khi có tín hiệu ưu tiên."
"Điều 14 Luật Giao thông đường bộ 2008 quy định: Xe vượt phải báo hiệu bằng đèn hoặc còi, vượt bên trái, trừ một số trường hợp được vượt bên phải.","Quy định về việc vượt xe là gì?","Xe vượt phải báo hiệu bằng đèn hoặc còi, vượt bên trái, trừ trường hợp được vượt bên phải."
"Điều 15 Luật Giao thông đường bộ 2008 quy định: Khi chuyển hướng, người điều khiển phương tiện phải báo hiệu, nhường đường cho xe ưu tiên và đảm bảo an toàn.","Quy định khi chuyển hướng phương tiện là gì?","Người điều khiển phương tiện phải báo hiệu, nhường đường cho xe ưu tiên và đảm bảo an toàn khi chuyển hướng."
"Điều 16 Luật Giao thông đường bộ 2008 quy định: Khi dừng, đỗ xe, người điều khiển phải báo hiệu, dừng sát lề đường bên phải và không gây cản trở giao thông.","Quy định khi dừng, đỗ xe trên đường bộ là gì?","Người điều khiển phải báo hiệu, dừng sát lề đường bên phải và không gây cản trở giao thông."
"Điều 17 Luật Giao thông đường bộ 2008 quy định: Người điều khiển xe thô sơ phải đi sát lề đường bên phải, không được gây cản trở giao thông.","Người điều khiển xe thô sơ phải đi như thế nào?","Người điều khiển xe thô sơ phải đi sát lề đường bên phải và không gây cản trở giao thông."
"Điều 18 Luật Giao thông đường bộ 2008 quy định: Khi dừng, đỗ xe trên đường, người điều khiển phải đặt biển báo hiệu nguy hiểm nếu xe chiếm phần đường xe chạy.","Quy định về biển báo khi dừng, đỗ xe là gì?","Người điều khiển phải đặt biển báo hiệu nguy hiểm nếu xe dừng, đỗ chiếm phần đường xe chạy."
"Điều 19 Luật Giao thông đường bộ 2008 quy định: Xe chở hàng phải đảm bảo hàng hóa được chằng buộc chắc chắn, không gây nguy hiểm cho người khác.","Quy định về chở hàng hóa trên phương tiện là gì?","Hàng hóa trên xe phải được chằng buộc chắc chắn, không gây nguy hiểm cho người khác."
"Điều 20 Luật Giao thông đường bộ 2008 quy định: Xe chở người phải đảm bảo số lượng người không vượt quá số chỗ quy định và phải có dây đai an toàn nếu bắt buộc.","Quy định về chở người trên phương tiện là gì?","Xe chở người không được vượt quá số chỗ quy định và phải có dây đai an toàn nếu bắt buộc."
"Điều 21 Luật Giao thông đường bộ 2008 quy định: Xe kéo rơ-moóc phải có tổng trọng lượng phù hợp với giấy chứng nhận kiểm định và không được chở người trên rơ-moóc.","Quy định về xe kéo rơ-moóc là gì?","Xe kéo rơ-moóc phải có tổng trọng lượng phù hợp và không được chở người trên rơ-moóc."
"Điều 22 Luật Giao thông đường bộ 2008 quy định: Xe ưu tiên bao gồm xe chữa cháy, xe quân sự, xe công an, xe cứu thương khi đang làm nhiệm vụ.","Những loại xe nào được coi là xe ưu tiên?","Xe ưu tiên bao gồm xe chữa cháy, xe quân sự, xe công an, xe cứu thương khi làm nhiệm vụ."
"Điều 23 Luật Giao thông đường bộ 2008 quy định: Xe ưu tiên phải có tín hiệu ưu tiên bằng còi, cờ hoặc đèn theo quy định khi làm nhiệm vụ.","Tín hiệu ưu tiên của xe ưu tiên là gì?","Xe ưu tiên phải có tín hiệu bằng còi, cờ hoặc đèn theo quy định khi làm nhiệm vụ."
"Điều 24 Luật Giao thông đường bộ 2008 quy định: Người điều khiển giao thông là cảnh sát giao thông hoặc người được giao nhiệm vụ hướng dẫn giao thông tại nơi thi công, ùn tắc.","Ai được coi là người điều khiển giao thông?","Người điều khiển giao thông là cảnh sát giao thông hoặc người được giao nhiệm vụ hướng dẫn giao thông."
"Điều 25 Luật Giao thông đường bộ 2008 quy định: Hiệu lệnh của người điều khiển giao thông có giá trị ưu tiên hơn đèn tín hiệu và biển báo.","Hiệu lệnh nào có giá trị ưu tiên hơn đèn tín hiệu và biển báo?","Hiệu lệnh của người điều khiển giao thông có giá trị ưu tiên hơn đèn tín hiệu và biển báo."
"Điều 26 Luật Giao thông đường bộ 2008 quy định: Đường bộ bao gồm đường, cầu, hầm, bến phà, và các công trình phụ trợ khác.","Đường bộ bao gồm những gì?","Đường bộ bao gồm đường, cầu, hầm, bến phà và các công trình phụ trợ khác."
"Điều 27 Luật Giao thông đường bộ 2008 quy định: Kết cấu hạ tầng giao thông đường bộ phải đảm bảo an toàn, thông suốt và phù hợp với quy chuẩn kỹ thuật.","Yêu cầu đối với kết cấu hạ tầng giao thông đường bộ là gì?","Kết cấu hạ tầng giao thông đường bộ phải đảm bảo an toàn, thông suốt và phù hợp quy chuẩn kỹ thuật."
"Điều 28 Luật Giao thông đường bộ 2008 quy định: Đường cao tốc chỉ dành cho xe cơ giới chạy với tốc độ cao, có dải phân cách và không giao nhau cùng mức với đường khác.","Đường cao tốc có đặc điểm gì?","Đường cao tốc dành cho xe cơ giới, có dải phân cách và không giao nhau cùng mức với đường khác."
"Điều 29 Luật Giao thông đường bộ 2008 quy định: Tổ chức, cá nhân sử dụng đường bộ phải trả phí sử dụng đường bộ theo quy định của pháp luật.","Ai phải trả phí sử dụng đường bộ?","Tổ chức, cá nhân sử dụng đường bộ phải trả phí theo quy định."
"Điều 30 Luật Giao thông đường bộ 2008 quy định: Công trình báo hiệu đường bộ bao gồm đèn tín hiệu, biển báo, cọc tiêu, vạch kẻ đường, và các thiết bị khác.","Công trình báo hiệu đường bộ bao gồm những gì?","Công trình báo hiệu đường bộ gồm đèn tín hiệu, biển báo, cọc tiêu, vạch kẻ đường và các thiết bị khác."
"Điều 31 Luật Giao thông đường bộ 2008 quy định: Công trình báo hiệu đường bộ phải được ưu tiên lắp đặt tại nơi giao nhau, khu đông dân cư hoặc nơi có nguy cơ tai nạn cao.","Công trình báo hiệu đường bộ được ưu tiên lắp đặt ở đâu?","Công trình báo hiệu đường bộ được ưu tiên lắp đặt tại nơi giao nhau, khu đông dân cư hoặc nơi có nguy cơ tai nạn cao."
"Điều 32 Luật Giao thông đường bộ 2008 quy định: Tổ chức, cá nhân muốn thi công trên đường bộ phải được cơ quan có thẩm quyền cho phép và đảm bảo an toàn giao thông.","Điều kiện để thi công trên đường bộ là gì?","Thi công trên đường bộ phải được cơ quan có thẩm quyền cho phép và đảm bảo an toàn giao thông."
"Điều 33 Luật Giao thông đường bộ 2008 quy định: Khi đường bộ bị ùn tắc, cơ quan có thẩm quyền phải tổ chức điều tiết giao thông để giải tỏa.","Ai có trách nhiệm điều tiết giao thông khi đường bộ bị ùn tắc?","Cơ quan có thẩm quyền phải tổ chức điều tiết giao thông khi đường bộ bị ùn tắc."
"Điều 34 Luật Giao thông đường bộ 2008 quy định: Phương tiện giao thông đường bộ phải được đăng ký và gắn biển số theo quy định của pháp luật.","Phương tiện giao thông đường bộ phải đáp ứng yêu cầu gì về đăng ký?","Phương tiện giao thông đường bộ phải được đăng ký và gắn biển số theo quy định."
"Điều 35 Luật Giao thông đường bộ 2008 quy định: Phương tiện giao thông đường bộ phải đảm bảo an toàn kỹ thuật và bảo vệ môi trường theo quy chuẩn.","Yêu cầu về an toàn kỹ thuật của phương tiện giao thông đường bộ là gì?","Phương tiện phải đảm bảo an toàn kỹ thuật và bảo vệ môi trường theo quy chuẩn."
"Điều 36 Luật Giao thông đường bộ 2008 quy định: Xe cơ giới phải được kiểm định định kỳ về an toàn kỹ thuật và bảo vệ môi trường.","Xe cơ giới phải được kiểm định định kỳ về những gì?","Xe cơ giới phải được kiểm định định kỳ về an toàn kỹ thuật và bảo vệ môi trường."
"Điều 37 Luật Giao thông đường bộ 2008 quy định: Xe máy chuyên dùng tham gia giao thông phải có chứng nhận kiểm định an toàn kỹ thuật và bảo vệ môi trường.","Xe máy chuyên dùng cần giấy tờ gì khi tham gia giao thông?","Xe máy chuyên dùng cần chứng nhận kiểm định an toàn kỹ thuật và bảo vệ môi trường."
"Điều 38 Luật Giao thông đường bộ 2008 quy định: Chủ phương tiện phải chịu trách nhiệm bảo đảm tình trạng kỹ thuật của phương tiện khi tham gia giao thông.","Ai chịu trách nhiệm về tình trạng kỹ thuật của phương tiện?","Chủ phương tiện chịu trách nhiệm bảo đảm tình trạng kỹ thuật của phương tiện."
"Điều 39 Luật Giao thông đường bộ 2008 quy định: Xe cơ giới phải có đủ đèn chiếu sáng, còi, gương chiếu hậu và các thiết bị an toàn khác theo quy định.","Xe cơ giới phải có những thiết bị an toàn nào?","Xe cơ giới phải có đèn chiếu sáng, còi, gương chiếu hậu và các thiết bị an toàn khác theo quy định."
"Điều 40 Luật Giao thông đường bộ 2008 quy định: Xe thô sơ phải có đèn, còi hoặc chuông, và phanh có hiệu lực khi tham gia giao thông.","Xe thô sơ cần có những thiết bị nào khi tham gia giao thông?","Xe thô sơ phải có đèn, còi hoặc chuông, và phanh có hiệu lực."
"Điều 41 Luật Giao thông đường bộ 2008 quy định: Người điều khiển xe mô tô, xe gắn máy phải đội mũ bảo hiểm có cài quai đúng quy cách.","Người điều khiển xe mô tô, xe gắn máy phải đội gì?","Người điều khiển xe mô tô, xe gắn máy phải đội mũ bảo hiểm có cài quai đúng quy cách."
"Điều 42 Luật Giao thông đường bộ 2008 quy định: Xe chở hàng nguy hiểm phải có giấy phép và tuân thủ quy định về vận chuyển hàng nguy hiểm.","Yêu cầu khi vận chuyển hàng nguy hiểm là gì?","Xe chở hàng nguy hiểm phải có giấy phép và tuân thủ quy định vận chuyển."
"Điều 43 Luật Giao thông đường bộ 2008 quy định: Vận chuyển động vật hoang dã phải tuân thủ quy định của pháp luật về bảo vệ động vật hoang dã.","Quy định về vận chuyển động vật hoang dã là gì?","Vận chuyển động vật hoang dã phải tuân thủ quy định của pháp luật về bảo vệ động vật hoang dã."
"Điều 44 Luật Giao thông đường bộ 2008 quy định: Kinh doanh vận tải đường bộ phải có giấy phép và đáp ứng các điều kiện theo quy định của pháp luật.","Điều kiện để kinh doanh vận tải đường bộ là gì?","Kinh doanh vận tải đường bộ phải có giấy phép và đáp ứng các điều kiện theo quy định."
"Điều 45 Luật Giao thông đường bộ 2008 quy định: Vận tải hành khách phải đảm bảo an toàn, đúng lịch trình và không chở quá số người quy định.","Yêu cầu đối với vận tải hành khách đường bộ là gì?","Vận tải hành khách phải đảm bảo an toàn, đúng lịch trình và không chở quá số người quy định."
"Điều 46 Luật Giao thông đường bộ 2008 quy định: Hành khách trên phương tiện vận tải phải tuân thủ quy định về an toàn và nội quy của phương tiện.","Hành khách trên phương tiện vận tải phải tuân thủ điều gì?","Hành khách phải tuân thủ quy định về an toàn và nội quy của phương tiện."
"Điều 47 Luật Giao thông đường bộ 2008 quy định: Vận tải hàng hóa phải đảm bảo an toàn, không làm hư hỏng hàng hóa và tuân thủ quy định pháp luật.","Quy định về vận tải hàng hóa đường bộ là gì?","Vận tải hàng hóa phải đảm bảo an toàn, không làm hư hỏng hàng hóa và tuân thủ pháp luật."
"Điều 48 Luật Giao thông đường bộ 2008 quy định: Doanh nghiệp vận tải phải chịu trách nhiệm bồi thường thiệt hại do lỗi của mình hoặc nhân viên gây ra.","Ai chịu trách nhiệm bồi thường thiệt hại trong vận tải đường bộ?","Doanh nghiệp vận tải chịu trách nhiệm bồi thường thiệt hại do lỗi của mình hoặc nhân viên."
"Điều 49 Luật Giao thông đường bộ 2008 quy định: Nhà nước khuyến khích phát triển vận tải hành khách công cộng để giảm phương tiện cá nhân ở các thành phố.","Chính sách về vận tải hành khách công cộng là gì?","Nhà nước khuyến khích phát triển vận tải hành khách công cộng để giảm phương tiện cá nhân."
"Điều 50 Luật Giao thông đường bộ 2008 quy định: Người điều khiển phương tiện phải có sức khỏe phù hợp với loại phương tiện và công việc điều khiển.","Yêu cầu về sức khỏe của người điều khiển phương tiện là gì?","Người điều khiển phương tiện phải có sức khỏe phù hợp với loại phương tiện và công việc."
"Điều 51 Luật Giao thông đường bộ 2008 quy định: Người điều khiển xe mô tô, xe gắn máy phải đủ 16 tuổi trở lên; người lái xe ô tô phải đủ 18 tuổi trở lên.","Độ tuổi tối thiểu để điều khiển xe mô tô và xe ô tô là bao nhiêu?","Người điều khiển xe mô tô phải đủ 16 tuổi, xe ô tô phải đủ 18 tuổi."
"Điều 52 Luật Giao thông đường bộ 2008 quy định: Người lái xe phải có giấy phép lái xe phù hợp với loại xe đang điều khiển.","Yêu cầu về giấy phép lái xe là gì?","Người lái xe phải có giấy phép lái xe phù hợp với loại xe đang điều khiển."
"Điều 53 Luật Giao thông đường bộ 2008 quy định: Người điều khiển xe máy chuyên dùng phải có chứng chỉ bồi dưỡng kiến thức pháp luật về giao thông đường bộ.","Người điều khiển xe máy chuyên dùng cần chứng chỉ gì?","Người điều khiển xe máy chuyên dùng cần chứng chỉ bồi dưỡng kiến thức pháp luật về giao thông."
"Điều 54 Luật Giao thông đường bộ 2008 quy định: Tổ chức, cá nhân đào tạo lái xe phải có giấy phép và đáp ứng các điều kiện theo quy định.","Điều kiện để đào tạo lái xe là gì?","Tổ chức, cá nhân đào tạo lái xe phải có giấy phép và đáp ứng các điều kiện theo quy định."
"Điều 55 Luật Giao thông đường bộ 2008 quy định: Xe cơ giới phải có giấy chứng nhận kiểm định an toàn kỹ thuật và bảo vệ môi trường còn hiệu lực.","Xe cơ giới cần giấy tờ gì về kiểm định?","Xe cơ giới cần giấy chứng nhận kiểm định an toàn kỹ thuật và bảo vệ môi trường còn hiệu lực."
"Điều 56 Luật Giao thông đường bộ 2008 quy định: Cơ quan đăng kiểm phải chịu trách nhiệm về kết quả kiểm định phương tiện.","Ai chịu trách nhiệm về kết quả kiểm định phương tiện?","Cơ quan đăng kiểm chịu trách nhiệm về kết quả kiểm định phương tiện."
"Điều 57 Luật Giao thông đường bộ 2008 quy định: Xe cơ giới không đạt tiêu chuẩn an toàn kỹ thuật và bảo vệ môi trường không được phép tham gia giao thông.","Xe cơ giới nào không được tham gia giao thông?","Xe cơ giới không đạt tiêu chuẩn an toàn kỹ thuật và bảo vệ môi trường không được tham gia giao thông."
"Điều 58 Luật Giao thông đường bộ 2008 quy định: Người lái xe phải mang giấy đăng ký xe, giấy phép lái xe, giấy chứng nhận kiểm định và bảo hiểm trách nhiệm dân sự.","Người lái xe phải mang những giấy tờ gì?","Người lái xe phải mang giấy đăng ký xe, giấy phép lái xe, giấy chứng nhận kiểm định và bảo hiểm trách nhiệm dân sự."
"Điều 59 Luật Giao thông đường bộ 2008 quy định: Giấy phép lái xe được cấp theo hạng, phù hợp với loại xe và số chỗ ngồi của phương tiện.","Giấy phép lái xe được cấp theo tiêu chí nào?","Giấy phép lái xe được cấp theo hạng, phù hợp với loại xe và số chỗ ngồi."
"Điều 60 Luật Giao thông đường bộ 2008 quy định: Tuổi tối đa của người lái xe ô tô chở người trên 30 chỗ là 55 tuổi đối với nam và 50 tuổi đối với nữ.","Tuổi tối đa của người lái xe ô tô chở người trên 30 chỗ là bao nhiêu?","Tuổi tối đa là 55 tuổi đối với nam và 50 tuổi đối với nữ."
"Điều 61 Luật Giao thông đường bộ 2008 quy định: Người lái xe phải được kiểm tra sức khỏe định kỳ theo quy định của pháp luật.","Người lái xe phải kiểm tra sức khỏe khi nào?","Người lái xe phải kiểm tra sức khỏe định kỳ theo quy định."
"Điều 62 Luật Giao thông đường bộ 2008 quy định: Người học lái xe phải học lý thuyết, thực hành lái xe và thi sát hạch để được cấp giấy phép lái xe.","Yêu cầu để được cấp giấy phép lái xe là gì?","Người học lái xe phải học lý thuyết, thực hành và thi sát hạch."
"Điều 63 Luật Giao thông đường bộ 2008 quy định: Giấy phép lái xe có thể bị thu hồi nếu người lái xe vi phạm nghiêm trọng quy định về giao thông đường bộ.","Khi nào giấy phép lái xe có thể bị thu hồi?","Giấy phép lái xe có thể bị thu hồi nếu người lái xe vi phạm nghiêm trọng quy định giao thông."
"Điều 64 Luật Giao thông đường bộ 2008 quy định: Tổ chức, cá nhân vi phạm pháp luật giao thông đường bộ phải chịu trách nhiệm hành chính, dân sự hoặc hình sự.","Hậu quả pháp lý của việc vi phạm pháp luật giao thông là gì?","Vi phạm pháp luật giao thông phải chịu trách nhiệm hành chính, dân sự hoặc hình sự."
