context,question,answer
"Điều 151 Bộ luật Hình sự 2015 quy định: Tội vận chuyển trái phép chất ma túy là hành vi vận chuyển chất ma túy trái phép, không nhằm mục đích sản xuất, buôn bán hoặc tàng trữ.","Tội vận chuyển trái phép chất ma túy là gì theo Điều 151?","Tội vận chuyển trái phép chất ma túy là hành vi vận chuyển chất ma túy trái phép, không nhằm mục đích sản xuất, buôn bán hoặc tàng trữ."
"Điều 152 Bộ luật Hình sự 2015 quy định: Tội tàng trữ trái phép chất ma túy là hành vi cất giữ, lưu giữ chất ma túy trái phép, không nhằm mục đích sản xuất, buôn bán hoặc vận chuyển.","Tội tàng trữ trái phép chất ma túy là gì theo Điều 152?","Tội tàng trữ trái phép chất ma túy là hành vi cất giữ, lưu giữ chất ma túy trái phép, không nhằm mục đích sản xuất, buôn bán hoặc vận chuyển."
"Điều 153 Bộ luật Hình sự 2015 quy định: Tội sản xuất trái phép chất ma túy là hành vi sản xuất, chế tạo chất ma túy trái với quy định của pháp luật.","Tội sản xuất trái phép chất ma túy là gì theo Điều 153?","Tội sản xuất trái phép chất ma túy là hành vi sản xuất, chế tạo chất ma túy trái với quy định của pháp luật."
"Điều 154 Bộ luật Hình sự 2015 quy định: Tội mua bán trái phép chất ma túy là hành vi mua bán, trao đổi chất ma túy trái với quy định của pháp luật.","Tội mua bán trái phép chất ma túy là gì theo Điều 154?","Tội mua bán trái phép chất ma túy là hành vi mua bán, trao đổi chất ma túy trái với quy định của pháp luật."
"Điều 155 Bộ luật Hình sự 2015 quy định: Tội tổ chức sử dụng trái phép chất ma túy là hành vi tổ chức, lôi kéo người khác sử dụng chất ma túy trái phép.","Tội tổ chức sử dụng trái phép chất ma túy là gì theo Điều 155?","Tội tổ chức sử dụng trái phép chất ma túy là hành vi tổ chức, lôi kéo người khác sử dụng chất ma túy trái phép."
"Điều 156 Bộ luật Hình sự 2015 quy định: Tội chứa chấp việc sử dụng trái phép chất ma túy là hành vi cung cấp địa điểm, phương tiện để người khác sử dụng chất ma túy trái phép.","Tội chứa chấp việc sử dụng trái phép chất ma túy là gì theo Điều 156?","Tội chứa chấp việc sử dụng trái phép chất ma túy là hành vi cung cấp địa điểm, phương tiện để người khác sử dụng chất ma túy trái phép."
"Điều 157 Bộ luật Hình sự 2015 quy định: Tội cưỡng ép người khác sử dụng trái phép chất ma túy là hành vi dùng vũ lực, đe dọa hoặc thủ đoạn khác ép buộc người khác sử dụng chất ma túy.","Tội cưỡng ép người khác sử dụng trái phép chất ma túy là gì theo Điều 157?","Tội cưỡng ép người khác sử dụng trái phép chất ma túy là hành vi dùng vũ lực, đe dọa hoặc thủ đoạn khác ép buộc người khác sử dụng chất ma túy."
"Điều 158 Bộ luật Hình sự 2015 quy định: Tội lôi kéo người khác sử dụng trái phép chất ma túy là hành vi dụ dỗ, kích động người khác sử dụng chất ma túy trái phép.","Tội lôi kéo người khác sử dụng trái phép chất ma túy là gì theo Điều 158?","Tội lôi kéo người khác sử dụng trái phép chất ma túy là hành vi dụ dỗ, kích động người khác sử dụng chất ma túy trái phép."
"Điều 159 Bộ luật Hình sự 2015 quy định: Tội sản xuất, tàng trữ, vận chuyển hoặc mua bán phương tiện, dụng cụ dùng vào việc sản xuất hoặc sử dụng trái phép chất ma túy là hành vi thực hiện các hành vi này liên quan đến phương tiện, dụng cụ phục vụ sản xuất hoặc sử dụng ma túy.","Tội liên quan đến phương tiện, dụng cụ sản xuất ma túy là gì theo Điều 159?","Tội sản xuất, tàng trữ, vận chuyển hoặc mua bán phương tiện, dụng cụ dùng vào việc sản xuất hoặc sử dụng trái phép chất ma túy là hành vi thực hiện các hành vi này."
"Điều 160 Bộ luật Hình sự 2015 quy định: Tội vi phạm quy định về quản lý chất ma túy là hành vi vi phạm quy định của Nhà nước về quản lý chất ma túy được phép sử dụng trong y tế, nghiên cứu.","Tội vi phạm quy định về quản lý chất ma túy là gì theo Điều 160?","Tội vi phạm quy định về quản lý chất ma túy là hành vi vi phạm quy định của Nhà nước về quản lý chất ma túy được phép sử dụng trong y tế, nghiên cứu."
"Điều 161 Bộ luật Hình sự 2015 quy định: Tội gây rối trật tự công cộng là hành vi gây rối, làm mất trật tự, an toàn công cộng tại nơi công cộng.","Tội gây rối trật tự công cộng là gì theo Điều 161?","Tội gây rối trật tự công cộng là hành vi gây rối, làm mất trật tự, an toàn công cộng tại nơi công cộng."
"Điều 162 Bộ luật Hình sự 2015 quy định: Tội chống người thi hành công vụ là hành vi dùng vũ lực, đe dọa hoặc thủ đoạn khác cản trở người thi hành công vụ thực hiện nhiệm vụ.","Tội chống người thi hành công vụ là gì theo Điều 162?","Tội chống người thi hành công vụ là hành vi dùng vũ lực, đe dọa hoặc thủ đoạn khác cản trở người thi hành công vụ thực hiện nhiệm vụ."
"Điều 163 Bộ luật Hình sự 2015 quy định: Tội làm nhục người thi hành công vụ là hành vi xúc phạm nghiêm trọng danh dự, nhân phẩm của người đang thi hành công vụ.","Tội làm nhục người thi hành công vụ là gì theo Điều 163?","Tội làm nhục người thi hành công vụ là hành vi xúc phạm nghiêm trọng danh dự, nhân phẩm của người đang thi hành công vụ."
"Điều 164 Bộ luật Hình sự 2015 quy định: Tội trốn khỏi nơi giam, giữ hoặc trốn khi đang bị dẫn giải, xét xử là hành vi trốn khỏi nơi giam giữ hoặc trong quá trình bị dẫn giải, xét xử.","Tội trốn khỏi nơi giam, giữ là gì theo Điều 164?","Tội trốn khỏi nơi giam, giữ là hành vi trốn khỏi nơi giam giữ hoặc trong quá trình bị dẫn giải, xét xử."
"Điều 165 Bộ luật Hình sự 2015 quy định: Tội tổ chức trốn khỏi nơi giam, giữ là hành vi tổ chức, giúp sức cho người khác trốn khỏi nơi giam giữ hoặc trong quá trình bị dẫn giải, xét xử.","Tội tổ chức trốn khỏi nơi giam, giữ là gì theo Điều 165?","Tội tổ chức trốn khỏi nơi giam, giữ là hành vi tổ chức, giúp sức cho người khác trốn khỏi nơi giam giữ hoặc trong quá trình bị dẫn giải, xét xử."
"Điều 166 Bộ luật Hình sự 2015 quy định: Tội chứa chấp hoặc tiếp tay cho người trốn khỏi nơi giam, giữ là hành vi cung cấp nơi trú ẩn hoặc phương tiện cho người trốn khỏi nơi giam giữ.","Tội chứa chấp hoặc tiếp tay cho người trốn khỏi nơi giam, giữ là gì theo Điều 166?","Tội chứa chấp hoặc tiếp tay cho người trốn khỏi nơi giam, giữ là hành vi cung cấp nơi trú ẩn hoặc phương tiện cho người trốn khỏi nơi giam giữ."
"Điều 167 Bộ luật Hình sự 2015 quy định: Tội làm giả con dấu, tài liệu của cơ quan, tổ chức là hành vi làm giả con dấu, tài liệu hoặc giấy tờ của cơ quan, tổ chức để sử dụng trái phép.","Tội làm giả con dấu, tài liệu của cơ quan, tổ chức là gì theo Điều 167?","Tội làm giả con dấu, tài liệu là hành vi làm giả con dấu, tài liệu hoặc giấy tờ của cơ quan, tổ chức để sử dụng trái phép."
"Điều 168 Bộ luật Hình sự 2015 quy định: Tội sử dụng con dấu hoặc tài liệu giả của cơ quan, tổ chức là hành vi sử dụng con dấu, tài liệu hoặc giấy tờ giả để lừa dối cơ quan, tổ chức hoặc cá nhân.","Tội sử dụng con dấu hoặc tài liệu giả là gì theo Điều 168?","Tội sử dụng con dấu hoặc tài liệu giả là hành vi sử dụng con dấu, tài liệu hoặc giấy tờ giả để lừa dối cơ quan, tổ chức hoặc cá nhân."
"Điều 169 Bộ luật Hình sự 2015 quy định: Tội chiếm đoạt, mua bán hoặc hủy hoại con dấu, tài liệu của cơ quan, tổ chức là hành vi chiếm đoạt, mua bán hoặc hủy hoại con dấu, tài liệu của cơ quan, tổ chức.","Tội chiếm đoạt, mua bán hoặc hủy hoại con dấu, tài liệu là gì theo Điều 169?","Tội chiếm đoạt, mua bán hoặc hủy hoại con dấu, tài liệu là hành vi chiếm đoạt, mua bán hoặc hủy hoại con dấu, tài liệu của cơ quan, tổ chức."
"Điều 170 Bộ luật Hình sự 2015 quy định: Tội giả mạo trong công tác là hành vi lợi dụng chức vụ, quyền hạn để giả mạo giấy tờ, tài liệu hoặc con dấu nhằm lừa dối hoặc chiếm đoạt tài sản.","Tội giả mạo trong công tác là gì theo Điều 170?","Tội giả mạo trong công tác là hành vi lợi dụng chức vụ, quyền hạn để giả mạo giấy tờ, tài liệu hoặc con dấu nhằm lừa dối hoặc chiếm đoạt tài sản."
"Điều 171 Bộ luật Hình sự 2015 quy định: Tội cung cấp tài liệu sai sự thật là hành vi cố ý cung cấp tài liệu, thông tin sai sự thật gây hậu quả nghiêm trọng.","Tội cung cấp tài liệu sai sự thật là gì theo Điều 171?","Tội cung cấp tài liệu sai sự thật là hành vi cố ý cung cấp tài liệu, thông tin sai sự thật gây hậu quả nghiêm trọng."
"Điều 172 Bộ luật Hình sự 2015 quy định: Tội vi phạm quy định về quản lý và sử dụng tài sản nhà nước gây thất thoát, lãng phí là hành vi vi phạm quy định về quản lý, sử dụng tài sản nhà nước gây thiệt hại nghiêm trọng.","Tội vi phạm quy định về quản lý tài sản nhà nước là gì theo Điều 172?","Tội vi phạm quy định về quản lý tài sản nhà nước là hành vi vi phạm quy định gây thất thoát, lãng phí tài sản nhà nước."
"Điều 173 Bộ luật Hình sự 2015 quy định: Tội thiếu trách nhiệm gây thất thoát tài sản nhà nước là hành vi thiếu trách nhiệm trong quản lý, sử dụng tài sản nhà nước dẫn đến thất thoát, lãng phí nghiêm trọng.","Tội thiếu trách nhiệm gây thất thoát tài sản nhà nước là gì theo Điều 173?","Tội thiếu trách nhiệm gây thất thoát tài sản nhà nước là hành vi thiếu trách nhiệm trong quản lý, sử dụng tài sản nhà nước dẫn đến thất thoát, lãng phí nghiêm trọng."
"Điều 174 Bộ luật Hình sự 2015 quy định: Tội cố ý công bố thông tin sai lệch hoặc che giấu thông tin trong hoạt động chứng khoán là hành vi cố ý công bố thông tin sai hoặc che giấu thông tin gây thiệt hại nghiêm trọng.","Tội cố ý công bố thông tin sai lệch trong hoạt động chứng khoán là gì theo Điều 174?","Tội cố ý công bố thông tin sai lệch là hành vi cố ý công bố thông tin sai hoặc che giấu thông tin trong hoạt động chứng khoán gây thiệt hại nghiêm trọng."
"Điều 175 Bộ luật Hình sự 2015 quy định: Tội thao túng thị trường chứng khoán là hành vi cố ý thực hiện hành vi thao túng giá chứng khoán hoặc giao dịch chứng khoán để thu lợi bất chính.","Tội thao túng thị trường chứng khoán là gì theo Điều 175?","Tội thao túng thị trường chứng khoán là hành vi cố ý thao túng giá chứng khoán hoặc giao dịch chứng khoán để thu lợi bất chính."
"Điều 176 Bộ luật Hình sự 2015 quy định: Tội vi phạm quy định về cạnh tranh là hành vi vi phạm quy định pháp luật về cạnh tranh gây thiệt hại nghiêm trọng cho người tiêu dùng hoặc doanh nghiệp.","Tội vi phạm quy định về cạnh tranh là gì theo Điều 176?","Tội vi phạm quy định về cạnh tranh là hành vi vi phạm pháp luật về cạnh tranh gây thiệt hại nghiêm trọng cho người tiêu dùng hoặc doanh nghiệp."
"Điều 177 Bộ luật Hình sự 2015 quy định: Tội vi phạm quy định về hoạt động bán đấu giá tài sản là hành vi vi phạm quy định pháp luật về bán đấu giá tài sản gây hậu quả nghiêm trọng.","Tội vi phạm quy định về bán đấu giá tài sản là gì theo Điều 177?","Tội vi phạm quy định về bán đấu giá tài sản là hành vi vi phạm pháp luật về bán đấu giá tài sản gây hậu quả nghiêm trọng."
"Điều 178 Bộ luật Hình sự 2015 quy định: Tội vi phạm quy định về quản lý, sử dụng đất đai là hành vi vi phạm quy định pháp luật về quản lý, sử dụng đất đai gây hậu quả nghiêm trọng.","Tội vi phạm quy định về quản lý đất đai là gì theo Điều 178?","Tội vi phạm quy định về quản lý đất đai là hành vi vi phạm pháp luật về quản lý, sử dụng đất đai gây hậu quả nghiêm trọng."
"Điều 179 Bộ luật Hình sự 2015 quy định: Tội vi phạm quy định về quản lý rừng là hành vi vi phạm quy định pháp luật về quản lý, bảo vệ rừng gây hậu quả nghiêm trọng.","Tội vi phạm quy định về quản lý rừng là gì theo Điều 179?","Tội vi phạm quy định về quản lý rừng là hành vi vi phạm pháp luật về quản lý, bảo vệ rừng gây hậu quả nghiêm trọng."
"Điều 180 Bộ luật Hình sự 2015 quy định: Tội vi phạm quy định về khai thác, bảo vệ thủy sản là hành vi vi phạm quy định pháp luật về khai thác, bảo vệ thủy sản gây hậu quả nghiêm trọng.","Tội vi phạm quy định về khai thác thủy sản là gì theo Điều 180?","Tội vi phạm quy định về khai thác thủy sản là hành vi vi phạm pháp luật về khai thác, bảo vệ thủy sản gây hậu quả nghiêm trọng."
"Điều 181 Bộ luật Hình sự 2015 quy định: Tội vi phạm quy định về bảo vệ động vật hoang dã là hành vi săn bắt, buôn bán, vận chuyển trái phép động vật hoang dã thuộc danh mục bảo vệ.","Tội vi phạm quy định về bảo vệ động vật hoang dã là gì theo Điều 181?","Tội vi phạm quy định về bảo vệ động vật hoang dã là hành vi săn bắt, buôn bán, vận chuyển trái phép động vật hoang dã thuộc danh mục bảo vệ."
"Điều 182 Bộ luật Hình sự 2015 quy định: Tội gây ô nhiễm môi trường là hành vi xả chất thải, chất độc hại ra môi trường gây ô nhiễm nghiêm trọng.","Tội gây ô nhiễm môi trường là gì theo Điều 182?","Tội gây ô nhiễm môi trường là hành vi xả chất thải, chất độc hại ra môi trường gây ô nhiễm nghiêm trọng."
"Điều 183 Bộ luật Hình sự 2015 quy định: Tội vi phạm quy định về quản lý chất thải nguy hại là hành vi vi phạm quy định về thu gom, vận chuyển, xử lý chất thải nguy hại gây hậu quả nghiêm trọng.","Tội vi phạm quy định về quản lý chất thải nguy hại là gì theo Điều 183?","Tội vi phạm quy định về quản lý chất thải nguy hại là hành vi vi phạm quy định về thu gom, vận chuyển, xử lý chất thải nguy hại gây hậu quả nghiêm trọng."
"Điều 184 Bộ luật Hình sự 2015 quy định: Tội nhập khẩu, phát tán động, thực vật ngoại lai xâm hại là hành vi nhập khẩu, phát tán động, thực vật ngoại lai gây thiệt hại nghiêm trọng cho môi trường hoặc hệ sinh thái.","Tội nhập khẩu, phát tán động, thực vật ngoại lai xâm hại là gì theo Điều 184?","Tội nhập khẩu, phát tán động, thực vật ngoại lai xâm hại là hành vi nhập khẩu, phát tán động, thực vật ngoại lai gây thiệt hại nghiêm trọng cho môi trường."
"Điều 185 Bộ luật Hình sự 2015 quy định: Tội vi phạm quy định về phòng, chống thiên tai là hành vi vi phạm quy định về phòng, chống thiên tai gây hậu quả nghiêm trọng.","Tội vi phạm quy định về phòng, chống thiên tai là gì theo Điều 185?","Tội vi phạm quy định về phòng, chống thiên tai là hành vi vi phạm quy định về phòng, chống thiên tai gây hậu quả nghiêm trọng."
"Điều 186 Bộ luật Hình sự 2015 quy định: Tội vi phạm quy định về an toàn thực phẩm là hành vi vi phạm quy định về sản xuất, kinh doanh thực phẩm gây hậu quả nghiêm trọng.","Tội vi phạm quy định về an toàn thực phẩm là gì theo Điều 186?","Tội vi phạm quy định về an toàn thực phẩm là hành vi vi phạm quy định về sản xuất, kinh doanh thực phẩm gây hậu quả nghiêm trọng."
"Điều 187 Bộ luật Hình sự 2015 quy định: Tội vi phạm quy định về khám bệnh, chữa bệnh, sản xuất, kinh doanh dược phẩm là hành vi vi phạm quy định về khám chữa bệnh, sản xuất, kinh doanh dược phẩm gây hậu quả nghiêm trọng.","Tội vi phạm quy định về khám chữa bệnh là gì theo Điều 187?","Tội vi phạm quy định về khám chữa bệnh là hành vi vi phạm quy định về khám chữa bệnh, sản xuất, kinh doanh dược phẩm gây hậu quả nghiêm trọng."
"Điều 188 Bộ luật Hình sự 2015 quy định: Tội vi phạm quy định về phòng, chống HIV/AIDS là hành vi vi phạm quy định về phòng, chống HIV/AIDS gây hậu quả nghiêm trọng.","Tội vi phạm quy định về phòng, chống HIV/AIDS là gì theo Điều 188?","Tội vi phạm quy định về phòng, chống HIV/AIDS là hành vi vi phạm quy định về phòng, chống HIV/AIDS gây hậu quả nghiêm trọng."
"Điều 189 Bộ luật Hình sự 2015 quy định: Tội truyền bá văn hóa phẩm đồi trụy là hành vi làm, tàng trữ, phát tán văn hóa phẩm có nội dung đồi trụy.","Tội truyền bá văn hóa phẩm đồi trụy là gì theo Điều 189?","Tội truyền bá văn hóa phẩm đồi trụy là hành vi làm, tàng trữ, phát tán văn hóa phẩm có nội dung đồi trụy."
"Điều 190 Bộ luật Hình sự 2015 quy định: Tội tổ chức mại dâm là hành vi tổ chức, lôi kéo, dụ dỗ người khác thực hiện hành vi mua bán dâm.","Tội tổ chức mại dâm là gì theo Điều 190?","Tội tổ chức mại dâm là hành vi tổ chức, lôi kéo, dụ dỗ người khác thực hiện hành vi mua bán dâm."
"Điều 191 Bộ luật Hình sự 2015 quy định: Tội chứa chấp mại dâm là hành vi cung cấp địa điểm, phương tiện để người khác thực hiện hành vi mua bán dâm.","Tội chứa chấp mại dâm là gì theo Điều 191?","Tội chứa chấp mại dâm là hành vi cung cấp địa điểm, phương tiện để người khác thực hiện hành vi mua bán dâm."
"Điều 192 Bộ luật Hình sự 2015 quy định: Tội môi giới mại dâm là hành vi làm trung gian, kết nối để người khác thực hiện hành vi mua bán dâm.","Tội môi giới mại dâm là gì theo Điều 192?","Tội môi giới mại dâm là hành vi làm trung gian, kết nối để người khác thực hiện hành vi mua bán dâm."
"Điều 193 Bộ luật Hình sự 2015 quy định: Tội mua dâm người dưới 18 tuổi là hành vi mua dâm người dưới 18 tuổi, bất kể tự nguyện hay không.","Tội mua dâm người dưới 18 tuổi là gì theo Điều 193?","Tội mua dâm người dưới 18 tuổi là hành vi mua dâm người dưới 18 tuổi, bất kể tự nguyện hay không."
"Điều 194 Bộ luật Hình sự 2015 quy định: Tội cưỡng bức mại dâm là hành vi dùng vũ lực, đe dọa hoặc thủ đoạn khác ép buộc người khác thực hiện hành vi mua bán dâm.","Tội cưỡng bức mại dâm là gì theo Điều 194?","Tội cưỡng bức mại dâm là hành vi dùng vũ lực, đe dọa hoặc thủ đoạn khác ép buộc người khác thực hiện hành vi mua bán dâm."
"Điều 195 Bộ luật Hình sự 2015 quy định: Tội vi phạm quy định về bảo vệ an toàn giao thông đường bộ là hành vi vi phạm quy định về điều khiển phương tiện giao thông đường bộ gây hậu quả nghiêm trọng.","Tội vi phạm quy định về an toàn giao thông đường bộ là gì theo Điều 195?","Tội vi phạm quy định về an toàn giao thông đường bộ là hành vi vi phạm quy định về điều khiển phương tiện giao thông đường bộ gây hậu quả nghiêm trọng."
"Điều 196 Bộ luật Hình sự 2015 quy định: Tội tổ chức đua xe trái phép là hành vi tổ chức, lôi kéo người khác tham gia đua xe trái phép trên đường giao thông.","Tội tổ chức đua xe trái phép là gì theo Điều 196?","Tội tổ chức đua xe trái phép là hành vi tổ chức, lôi kéo người khác tham gia đua xe trái phép trên đường giao thông."
"Điều 197 Bộ luật Hình sự 2015 quy định: Tội đua xe trái phép là hành vi tham gia đua xe trái phép trên đường giao thông gây hậu quả nghiêm trọng.","Tội đua xe trái phép là gì theo Điều 197?","Tội đua xe trái phép là hành vi tham gia đua xe trái phép trên đường giao thông gây hậu quả nghiêm trọng."
"Điều 198 Bộ luật Hình sự 2015 quy định: Tội vi phạm quy định về điều khiển phương tiện giao thông đường sắt là hành vi vi phạm quy định về điều khiển phương tiện giao thông đường sắt gây hậu quả nghiêm trọng.","Tội vi phạm quy định về giao thông đường sắt là gì theo Điều 198?","Tội vi phạm quy định về giao thông đường sắt là hành vi vi phạm quy định về điều khiển phương tiện giao thông đường sắt gây hậu quả nghiêm trọng."
"Điều 199 Bộ luật Hình sự 2015 quy định: Tội vi phạm quy định về điều khiển phương tiện giao thông đường thủy là hành vi vi phạm quy định về điều khiển phương tiện giao thông đường thủy gây hậu quả nghiêm trọng.","Tội vi phạm quy định về giao thông đường thủy là gì theo Điều 199?","Tội vi phạm quy định về giao thông đường thủy là hành vi vi phạm quy định về điều khiển phương tiện giao thông đường thủy gây hậu quả nghiêm trọng."
"Điều 200 Bộ luật Hình sự 2015 quy định: Tội vi phạm quy định về điều khiển phương tiện giao thông hàng không là hành vi vi phạm quy định về điều khiển phương tiện giao thông hàng không gây hậu quả nghiêm trọng.","Tội vi phạm quy định về giao thông hàng không là gì theo Điều 200?","Tội vi phạm quy định về giao thông hàng không là hành vi vi phạm quy định về điều khiển phương tiện giao thông hàng không gây hậu quả nghiêm trọng."